{"scenario_id":"EH-S02","bundle_id":"grounded_research_appendix_bundle","verdict":"Pass","guide_alignment":"aligned","evidence_strength":"direct","operator_only_dependency":false,"over_orchestration":false,"speculative_patch_widening":false,"missing_operational_artifact_route":false,"recommended_patch_needed":false,"minimal_patch_targets":[],"evidence_files":["prompt-stack/v32/harness/freezes/rg-2026-05-06-a/snapshot/prompt-stack/v32/codex/CODEX_RUNTIME_GUIDE.md","prompt-stack/v32/harness/freezes/rg-2026-05-06-a/snapshot/prompt-stack/v32/01_base/PROMPT_light.md","prompt-stack/v32/harness/freezes/rg-2026-05-06-a/snapshot/prompt-stack/v32/02_overlays/PROMPT_search_reasoning_overlay.md","prompt-stack/v32/harness/freezes/rg-2026-05-06-a/snapshot/prompt-stack/v32/03_examples/PROMPT_example_catalog.md","prompt-stack/v32/harness/freezes/rg-2026-05-06-a/snapshot/prompt-stack/v32/AGENTS.md"],"answer_summary":"Pass. 활성 번들은 Prompt Chaining을 base prompt 소유 경로로, Appendix A advanced prompting을 search-reasoning overlay 소유 경로로 직접 반영한다.","verdict_rationale":"직접 근거가 있다. `CODEX_RUNTIME_GUIDE.md`는 가이드 챕터-패밀리 매핑에서 Prompt Chaining/Planning을 base prompts로, Appendix A advanced prompting execution families를 `PROMPT_search_reasoning_overlay`로 명시적으로 연결한다. `PROMPT_light.md`에는 chaining/routing의 실행 규칙이 직접 들어 있어 Prompt Chaining이 runtime-owned base behavior로 유지된다. `PROMPT_search_reasoning_overlay.md`는 자신이 advanced prompting execution families의 runtime owner라고 직접 선언하고, decomposition, step-back, self-consistency-style comparison, ReAct-like loops, tree-style search, bounded reflection, debate/comparative critics를 실행 패밀리로 열거한다. `PROMPT_example_catalog.md`는 카탈로그가 advanced prompting/chaining owner가 아니라고 명시해 소유 경계를 흐리지 않는다. 또한 `CODEX_RUNTIME_GUIDE.md`는 runtime owner integrity와 chapter-family answerability에서는 document-level benchmark가 1차 충분면이라고 적어 두어, 이 질문에 assembled replay나 operator-only 문서가 필수 경로가 아니다. 과도한 orchestration도 직접 억제된다. `PROMPT_search_reasoning_overlay.md`는 multi-agent delegation을 자기 소관이 아니라고 하고, `PROMPT_light.md`와 `AGENTS.md`는 decorative planning/chaining을 금지한다.","limitations":["이 판정은 문서 수준의 runtime ownership 및 direct answer path에 대한 것이다. assembled replay 기반의 행동 증명까지 수행한 것은 아니다.","Appendix A 반영은 실행 패밀리와 ownership 경계 수준에서 직접 확인된다. active bundle만으로 Appendix A 전체의 완전한 가족 목록 커버리지를 더 넓게 주장하면 과장이다."]}