{"scenario_id":"EH-S04","bundle_id":"coding_core_patch_bundle","verdict":"Pass","guide_alignment":"aligned","evidence_strength":"direct","operator_only_dependency":false,"over_orchestration":false,"speculative_patch_widening":false,"missing_operational_artifact_route":false,"recommended_patch_needed":false,"minimal_patch_targets":[],"evidence_files":["C:\\WORK\\0.개인\\PROMPT\\prompt-stack\\v32\\harness\\freezes\\rg-2026-05-06-a\\snapshot\\prompt-stack\\v32\\AGENTS.md","C:\\WORK\\0.개인\\PROMPT\\prompt-stack\\v32\\harness\\freezes\\rg-2026-05-06-a\\snapshot\\prompt-stack\\v32\\01_base\\PROMPT_standalone.md","C:\\WORK\\0.개인\\PROMPT\\prompt-stack\\v32\\harness\\freezes\\rg-2026-05-06-a\\snapshot\\prompt-stack\\v32\\02_overlays\\PROMPT_tool_protocol_overlay.md","C:\\WORK\\0.개인\\PROMPT\\prompt-stack\\v32\\harness\\freezes\\rg-2026-05-06-a\\snapshot\\prompt-stack\\v32\\02_overlays\\PROMPT_guardrails_safety_overlay.md","C:\\WORK\\0.개인\\PROMPT\\prompt-stack\\v32\\harness\\freezes\\rg-2026-05-06-a\\snapshot\\prompt-stack\\v32\\codex\\CODEX_RUNTIME_GUIDE.md","C:\\WORK\\0.개인\\PROMPT\\prompt-stack\\v32\\harness\\freezes\\rg-2026-05-06-a\\snapshot\\prompt-stack\\v32\\codex\\skills\\coding-core\\SKILL.md"],"answer_summary":"활성 번들은 stale runtime-owner 문장을 로컬 runtime/control 문서 결함으로 좁혀서 가장 가능성 높은 owner file만 확인·수정하고, 문서 수준 benchmark로 검증하며, behavior-proof가 필요할 때만 assembled replay로 올리는 직접 경로를 제공한다.","verdict_rationale":"`coding-core`는 stale sentence / owner statement 같은 runtime/control 문서의 파일-로컬 결함을 가장 가능성 높은 owner file 가설로 먼저 다루고, 인접 ownership 문장을 확인한 뒤에도 근거가 약하면 patch를 넓히지 말고 propose-only로 남기라고 직접 지시한다. 같은 skill은 change에 맞는 smallest meaningful validation과 speculative patch widening 회피도 직접 요구한다. `CODEX_RUNTIME_GUIDE`는 `runtime owner integrity`에 대해 document-level benchmark가 1차 충분 경로이며, assembled replay는 ambiguity·conflict·behavior proof가 필요할 때만 fallback이라고 직접 노출한다. `AGENTS.md`, `PROMPT_standalone`, `PROMPT_tool_protocol_overlay`, `PROMPT_guardrails_safety_overlay`도 bounded change, local edits, narrow capability, no unnecessary orchestration, broad write 회피를 일관되게 소유하므로 이 시나리오는 out-of-scope operator 문서 없이 runtime-owned 경로만으로 해결 가능하다.","limitations":["구체적인 stale 문장과 대상 codex-layer 파일이 주어지지 않아 실제 patch target 특정은 정당화되지 않으며, 그래서 `minimal_patch_targets`는 비워 두는 것이 맞다.","판정은 active bundle이 제공하는 route와 owner-boundary 노출 여부 기준이며, 실제 patch 실행 결과나 replay 실행 artifact 상태를 검토한 것은 아니다."]}