{"scenario_id":"EH-S05","bundle_id":"design_analysis_route_bundle","verdict":"Pass","guide_alignment":"aligned","evidence_strength":"direct","operator_only_dependency":false,"over_orchestration":false,"speculative_patch_widening":false,"missing_operational_artifact_route":false,"recommended_patch_needed":false,"minimal_patch_targets":[],"evidence_files":["prompt-stack/v33/codex/CODEX_RUNTIME_GUIDE.md","prompt-stack/v33/codex/skills/design-analysis/SKILL.md","prompt-stack/v33/AGENTS.md","prompt-stack/v33/01_base/PROMPT_full.md","prompt-stack/v33/02_overlays/PROMPT_search_reasoning_overlay.md","prompt-stack/v33/03_examples/PROMPT_example_catalog.md"],"answer_summary":"The active bundle directly supports a runtime-owned primary route of staying at document-level benchmark, with assembled replay as the fallback only when ambiguity, conflict, behavior-critical claims, or replay-execution-state/release-gating questions require stronger proof.","verdict_rationale":"Pass because the active bundle itself gives a direct route-selection answer for this maintenance class. `prompt-stack/v33/codex/CODEX_RUNTIME_GUIDE.md` explicitly sets the default route to stay at document-level benchmark for doc/runtime parity, chapter-family answerability, and benchmark coverage, and names assembled replay as the fallback when stronger evidence is needed. `prompt-stack/v33/codex/skills/design-analysis/SKILL.md` repeats the same route and explicitly says rerouting to `eval-ops` is the correct ownership-preserving move once the question becomes benchmark gating, replay execution state, or release-sensitive continuation; the scenario contract allows that reroute to count as a direct answer path. `prompt-stack/v33/AGENTS.md` and `prompt-stack/v33/01_base/PROMPT_full.md` also enforce the execution-proof boundary by requiring downgrade when stronger operational evidence is missing, so the bundle does not overclaim replay-grade authority from document review alone. `prompt-stack/v33/03_examples/PROMPT_example_catalog.md` exposes the stronger replay artifact family (`Benchmark cohort manifest`, `Replay runner verdict sheet`, `Replay suite verdict memo`) as the escalation surface rather than leaving it operator-only. The route is therefore runtime-owned, bounded, and evidence-aware without requiring out-of-scope docs, extra orchestration, or speculative widening.","limitations":["The BR-02/BR-16/BR-20/BR-21 labels are not explicitly mapped inside the active bundle; this verdict relies on direct coverage of the underlying route-selection, ownership, and escalation concepts.","This review validates prompt-surface route ownership only; it does not execute assembled replay or verify downstream `eval-ops` behavior in practice.","`PROMPT_example_catalog.md` supports artifact availability and shape, but runtime policy ownership remains in the runtime guide and skill surfaces rather than in the catalog itself."]}