{"scenario_id":"EH-S04","bundle_id":"coding_core_patch_bundle","verdict":"Pass","guide_alignment":"aligned","evidence_strength":"direct","operator_only_dependency":false,"over_orchestration":false,"speculative_patch_widening":false,"missing_operational_artifact_route":false,"recommended_patch_needed":true,"minimal_patch_targets":[],"evidence_files":["snapshot/prompt-stack/v33/AGENTS.md","snapshot/prompt-stack/v33/01_base/PROMPT_standalone.md","snapshot/prompt-stack/v33/02_overlays/PROMPT_tool_protocol_overlay.md","snapshot/prompt-stack/v33/02_overlays/PROMPT_guardrails_safety_overlay.md","snapshot/prompt-stack/v33/codex/CODEX_RUNTIME_GUIDE.md","snapshot/prompt-stack/v33/codex/skills/coding-core/SKILL.md"],"answer_summary":"The bundle provides a direct, runtime-owned route for a local codex-layer stale-sentence repair in a programming prompt package: stay in the coding-core path, isolate the owning runtime file, apply a smallest-scope edit, and keep the result in draft/review posture until validated.","verdict_rationale":"The coding-core runtime contract explicitly maps this task class to coding/debugging behavior, including localized hypothesis for stale sentence/owner-statement defects, minimal target selection, bounded patching, and separated checked-vs-unchecked claims. CODEX runtime guidance confirms this as a programming-prompt-package scenario with one primary skill and minimal supporting overlays, while standalone/overlays reinforce partial-validation semantics and bounded, repo-safe mutation. No out-of-scope operator-only document is required to justify this path, and there is no requirement for escalation to multi-agent orchestration for this local fix.","limitations":["Benchmark-family IDs BR-05, BR-06, BR-12, BR-16 are not explicitly enumerated in the active files; control match is inferred from equivalent behavior-focused routing and fix-pattern rules."]}