{"scenario_id":"EH-S02","bundle_id":"grounded_research_appendix_bundle","verdict":"Pass","guide_alignment":"aligned","evidence_strength":"direct","operator_only_dependency":false,"over_orchestration":false,"speculative_patch_widening":false,"missing_operational_artifact_route":false,"recommended_patch_needed":false,"minimal_patch_targets":[],"evidence_files":["C:\\WORK\\0.개인\\PROMPT\\prompt-stack\\v33\\harness\\freezes\\rg-2026-05-18-a\\snapshot\\prompt-stack\\v33\\01_base\\PROMPT_light.md","C:\\WORK\\0.개인\\PROMPT\\prompt-stack\\v33\\harness\\freezes\\rg-2026-05-18-a\\snapshot\\prompt-stack\\v33\\02_overlays\\PROMPT_retrieval_grounding_overlay.md","C:\\WORK\\0.개인\\PROMPT\\prompt-stack\\v33\\harness\\freezes\\rg-2026-05-18-a\\snapshot\\prompt-stack\\v33\\02_overlays\\PROMPT_search_reasoning_overlay.md","C:\\WORK\\0.개인\\PROMPT\\prompt-stack\\v33\\harness\\freezes\\rg-2026-05-18-a\\snapshot\\prompt-stack\\v33\\codex\\CODEX_RUNTIME_GUIDE.md","C:\\WORK\\0.개인\\PROMPT\\prompt-stack\\v33\\harness\\freezes\\rg-2026-05-18-a\\snapshot\\prompt-stack\\v33\\codex\\skills\\grounded-research\\SKILL.md","C:\\WORK\\0.개인\\PROMPT\\prompt-stack\\v33\\harness\\freezes\\rg-2026-05-18-a\\snapshot\\prompt-stack\\v33\\03_examples\\PROMPT_example_catalog.md","C:\\WORK\\0.개인\\PROMPT\\prompt-stack\\v33\\harness\\freezes\\rg-2026-05-18-a\\snapshot\\prompt-stack\\v33\\AGENTS.md"],"answer_summary":"The active bundle directly reflects all three target areas. `PROMPT_light.md` directly owns prompt chaining as a justified conditional branch and staged-path rule; `PROMPT_search_reasoning_overlay.md` and `CODEX_RUNTIME_GUIDE.md` directly map Appendix A advanced prompting execution families to the search-reasoning runtime surface while keeping prompt chaining in base prompts; `grounded-research/SKILL.md` plus `CODEX_RUNTIME_GUIDE.md` directly require official-source priority for freshness-sensitive SDK/framework/model/API guidance, with `PROMPT_retrieval_grounding_overlay.md` supplying the freshness/currentness discipline.","verdict_rationale":"Pass is justified because the answer path is runtime-owned and explicit inside the active bundle. Prompt chaining is not merely hinted by examples: `PROMPT_light.md` names it as an active branch and gives direct use/stop rules, while `CODEX_RUNTIME_GUIDE.md` routes 'Prompt Chaining / Planning' to base prompts. Appendix A advanced prompting is also runtime-owned: `PROMPT_search_reasoning_overlay.md` states that it is the runtime owner for advanced prompting execution families and explicitly lists the covered families; `CODEX_RUNTIME_GUIDE.md` repeats that Appendix A execution families belong there and that prompt chaining stays in base prompts. Freshness-sensitive programming research is directly reflected by `grounded-research/SKILL.md` and `CODEX_RUNTIME_GUIDE.md`, both of which prefer official docs for fresh SDK/framework/model/API guidance, and by `PROMPT_retrieval_grounding_overlay.md`, which activates on fresher information and requires explicit freshness/currentness handling. No operator-only document is required to answer this task, and `CODEX_RUNTIME_GUIDE.md` explicitly says document-level benchmark is the primary sufficient surface for runtime owner integrity when runtime-owned docs expose the boundary, so stronger assembled-replay artifacts are not required here.","limitations":["`PROMPT_example_catalog.md` supports coverage only as structure evidence; it explicitly disclaims ownership of chaining and advanced prompting policy, so runtime ownership must be taken from `PROMPT_light.md`, `PROMPT_search_reasoning_overlay.md`, and `CODEX_RUNTIME_GUIDE.md`.","The bundle proves document-level runtime carryover and source-priority rules, not live behavioral replay performance."]}