{"scenario_id":"EH-S02","bundle_id":"grounded_research_appendix_bundle","verdict":"Partial Pass","guide_alignment":"partially_aligned","evidence_strength":"indirect","operator_only_dependency":false,"over_orchestration":false,"speculative_patch_widening":false,"missing_operational_artifact_route":true,"recommended_patch_needed":false,"minimal_patch_targets":[],"evidence_files":["prompt-stack/v32/AGENTS.md","prompt-stack/v32/01_base/PROMPT_light.md","prompt-stack/v32/02_overlays/PROMPT_search_reasoning_overlay.md","prompt-stack/v32/codex/CODEX_RUNTIME_GUIDE.md","prompt-stack/v32/03_examples/PROMPT_example_catalog.md"],"answer_summary":"Prompt Chaining is directly reflected as a controlled execution pattern in the active runtime (PROMPT_light’s chaining/routing policy), and Appendix A advanced prompting families are explicitly owned by `PROMPT_search_reasoning_overlay` with prompt chaining anchored in base prompts; `CODEX_RUNTIME_GUIDE` reinforces this ownership split. Direct family-to-BR semantics for BR-01/BR-14/BR-17/BR-22 are not explicit in-band, so verdict confidence is bounded.","verdict_rationale":"The active runtime bundle provides a direct runtime-owned path for chaining and Appendix A mechanics: PROMPT_light controls when staged chaining/routing is used, while PROMPT_search_reasoning_overlay section 10.9 defines advanced prompting execution families and treats examples as structure-only, and the guide points base prompts to chaining ownership and search overlay to advanced prompting families. However, BR-specific mapping and required family-level thresholds are not directly present in the active files, so the family-coverage answer is only partially direct and partly inferential.","limitations":["`BR-01/BR-14/BR-17/BR-22` are not named in the active bundle, so benchmark-family-level scoring can only be inferred, not directly verified from listed files.","No assembled replay or runner-level verdict artifacts are exposed in this bundle; stronger operational proof would require additional artifacts for replay-grade confidence.","Evidence is policy/ownership direct for the concepts, but not family-specific execution-level outcome proof." ]}