{"scenario_id":"EH-S02","bundle_id":"grounded_research_appendix_bundle","verdict":"Pass","guide_alignment":"aligned","evidence_strength":"direct","operator_only_dependency":false,"over_orchestration":false,"speculative_patch_widening":false,"missing_operational_artifact_route":false,"recommended_patch_needed":false,"minimal_patch_targets":[],"evidence_files":["C:\\WORK\\0.개인\\PROMPT\\prompt-stack\\v33\\01_base\\PROMPT_light.md","C:\\WORK\\0.개인\\PROMPT\\prompt-stack\\v33\\02_overlays\\PROMPT_retrieval_grounding_overlay.md","C:\\WORK\\0.개인\\PROMPT\\prompt-stack\\v33\\02_overlays\\PROMPT_search_reasoning_overlay.md","C:\\WORK\\0.개인\\PROMPT\\prompt-stack\\v33\\codex\\skills\\grounded-research\\SKILL.md","C:\\WORK\\0.개인\\PROMPT\\prompt-stack\\v33\\codex\\CODEX_RUNTIME_GUIDE.md"],"answer_summary":"`Prompt Chaining`, `Appendix A`(advanced prompting families), and freshness-sensitive `programming` research are directly represented in the active runtime bundle with explicit ownership and policy. Prompt chaining appears in base execution model and search reasoning controls; Appendix A advanced prompting families are mapped to runtime owners in the search overlay and codex guide; freshness-sensitive programming guidance is explicitly governed by grounded-research source-ranking rules (official sources preferred) plus retrieval freshness/currentness discipline.","verdict_rationale":"Direct path exists in-bundle: `PROMPT_light` names prompt chaining in the runtime flow; `PROMPT_search_reasoning_overlay` defines and bounds advanced prompting techniques (decomposition, self-consistency, ReAct, tree search, reflection) and explicitly ties Appendix A-style families to non-overlay ownership; `grounded-research` requires official-source prioritization for fresh programming/API guidance; `PROMPT_retrieval_grounding_overlay` covers freshness and currentness checks; `CODEX_RUNTIME_GUIDE` maps these families to the correct owning surfaces (base/search/grounded-research), while keeping examples as immutable shape data. BR IDs need not be literal because underlying routes are directly owned in the active files.","limitations":["The BR IDs (BR-01/14/17/22) are not literally enumerated in these files; coverage is through concept-to-owner mappings rather than checklist-style family labels.","The bundle is a runtime/doc-layer ownership artifact; it validates policy coverage, not actual runtime execution behavior from assembled replays."]}