{"scenario_id":"EH-S04","bundle_id":"coding_core_patch_bundle","verdict":"Pass","guide_alignment":"aligned","evidence_strength":"direct","operator_only_dependency":false,"over_orchestration":false,"speculative_patch_widening":false,"missing_operational_artifact_route":false,"recommended_patch_needed":false,"minimal_patch_targets":[],"evidence_files":["prompt-stack/v32/harness/freezes/rg-2026-05-06-a/snapshot/prompt-stack/v32/codex/skills/coding-core/SKILL.md","prompt-stack/v32/harness/freezes/rg-2026-05-06-a/snapshot/prompt-stack/v32/codex/CODEX_RUNTIME_GUIDE.md","prompt-stack/v32/harness/freezes/rg-2026-05-06-a/snapshot/prompt-stack/v32/03_examples/PROMPT_example_catalog.md","prompt-stack/v32/harness/freezes/rg-2026-05-06-a/snapshot/prompt-stack/v32/AGENTS.md","prompt-stack/v32/harness/freezes/rg-2026-05-06-a/snapshot/prompt-stack/v32/01_base/PROMPT_standalone.md","prompt-stack/v32/harness/freezes/rg-2026-05-06-a/snapshot/prompt-stack/v32/02_overlays/PROMPT_guardrails_safety_overlay.md"],"answer_summary":"The active bundle provides a direct runtime-owned path: treat the stale codex-layer owner sentence as a localized runtime/control-doc defect, patch only the smallest likely owner file after checking adjacent ownership text, and verify with a document-level runtime-owner benchmark/rerun rather than assembled replay.","verdict_rationale":"Pass because the answer path is directly exposed inside the active runtime bundle. `coding-core/SKILL.md` explicitly routes stale sentence or owner-statement defects in runtime/control docs to the smallest likely owner file first, requires confirming adjacent ownership statements before widening, and prefers the smallest meaningful validation. `CODEX_RUNTIME_GUIDE.md` keeps runtime-owner integrity and chapter-family answerability as direct maintenance families, says document-level benchmark is the primary sufficient surface for runtime owner integrity, and states replay escalation is not required unless the claim moves into behavior proof or runner state. It also says that if only operator-facing prose can answer a family, the fix is to patch the actual prompt docs rather than rely on operator-only material. `PROMPT_example_catalog.md` provides a matching document-grounded verification shape with `runtime_owner_check`, `patch_target`, and rerun trigger, while flagging stale ownership claims left alive after a patch round as an anti-pattern. `AGENTS.md`, `PROMPT_standalone.md`, and the safety overlay reinforce bounded change, narrow diffs, smallest-safe-change behavior, and anti-widening discipline. This supports a narrow local doc repair route without operator-only dependency, unnecessary orchestration, or stronger operational artifacts.","limitations":["The scenario does not expose the exact stale sentence or exact codex-layer file, so the concrete patch target cannot be named from bundle evidence alone.","No assembled replay or runner artifact was executed here; the bundle makes that acceptable because this scenario stays at document/runtime parity rather than behavior-proof scope."]}