{"scenario_id":"EH-S04","bundle_id":"coding_core_patch_bundle","verdict":"Pass","guide_alignment":"aligned","evidence_strength":"direct","operator_only_dependency":false,"over_orchestration":false,"speculative_patch_widening":false,"missing_operational_artifact_route":false,"recommended_patch_needed":true,"minimal_patch_targets":[],"evidence_files":["prompt-stack/v32/AGENTS.md","prompt-stack/v32/01_base/PROMPT_standalone.md","prompt-stack/v32/02_overlays/PROMPT_tool_protocol_overlay.md","prompt-stack/v32/02_overlays/PROMPT_guardrails_safety_overlay.md","prompt-stack/v32/codex/CODEX_RUNTIME_GUIDE.md","prompt-stack/v32/codex/skills/coding-core/SKILL.md"],"answer_summary":"Runtime guidance is self-contained for a minimal, local codex-layer doc repair: use the coding-core path, keep scope bounded, and apply the smallest safe change without widening.","verdict_rationale":"The active bundle provides direct ownership of the fix workflow through base AGENTS routing/verification policy, tool/guardrail constraints, and the coding-core skill guidance. This is sufficient to choose a targeted, local doc-edit response plus lightweight verification, so no out-of-scope operator docs are required. The path is therefore runtime-owned and non-orchestrated.","limitations":["The user-reported stale sentence/location is not explicitly named in the active bundle slice, so the exact target sentence cannot be uniquely pinned in this evaluation."]}