{"scenario_id":"EH-S03","bundle_id":"orchestration_sufficiency_bundle","verdict":"Pass","guide_alignment":"aligned","evidence_strength":"direct","operator_only_dependency":false,"over_orchestration":false,"speculative_patch_widening":false,"missing_operational_artifact_route":false,"recommended_patch_needed":false,"minimal_patch_targets":[],"evidence_files":["prompt-stack/v33/harness/freezes/rg-2026-05-18-a/snapshot/prompt-stack/v33/AGENTS.md","prompt-stack/v33/harness/freezes/rg-2026-05-18-a/snapshot/prompt-stack/v33/01_base/PROMPT_full.md","prompt-stack/v33/harness/freezes/rg-2026-05-18-a/snapshot/prompt-stack/v33/02_overlays/PROMPT_multi_agent_overlay.md","prompt-stack/v33/harness/freezes/rg-2026-05-18-a/snapshot/prompt-stack/v33/codex/CODEX_RUNTIME_GUIDE.md","prompt-stack/v33/harness/freezes/rg-2026-05-18-a/snapshot/prompt-stack/v33/codex/skills/orchestration-control/SKILL.md","prompt-stack/v33/harness/freezes/rg-2026-05-18-a/snapshot/prompt-stack/v33/03_examples/PROMPT_example_catalog.md"],"answer_summary":"활성 번들은 이 유지보수 과제에 대해 단일 에이전트 sufficiency를 직접 지지합니다. `CODEX_RUNTIME_GUIDE.md`는 guide-reflection / benchmark maintenance의 기본 경로를 `eval-ops` 기반 document-level benchmark로 두고 assembled replay는 fallback으로만 올리며, `AGENTS.md`, `PROMPT_full.md`, `PROMPT_multi_agent_overlay.md`, `orchestration-control/SKILL.md`는 모두 multi-agent/A2A를 distinct coordination gain이 있을 때만 허용하고 그렇지 않으면 더 단순한 경로로 유지 또는 복귀하라고 명시합니다.","verdict_rationale":"Pass입니다. 필요한 답변 경로는 활성 번들 안에서 직접 런타임 소유로 제공됩니다. `CODEX_RUNTIME_GUIDE.md`의 prompt-stack guide reflection / benchmark maintenance 섹션은 이 작업군의 primary bundle을 `eval-ops` 중심으로 두고, primary route를 document-level benchmark로 규정하며, `runtime owner integrity`와 `benchmark-loop adequacy`에는 replay escalation이 필수가 아니라고 직접 적습니다. 동시에 `AGENTS.md`는 unnecessary orchestration 최소화, lowest maturity surface 선택, decorative orchestration 회피를 요구하고, `PROMPT_full.md`는 one coherent agent path 선호, heavier path 금지, multi-agent activation의 엄격한 조건을 둡니다. `PROMPT_multi_agent_overlay.md`와 `orchestration-control/SKILL.md`도 one coherent agent로 풀 수 있는 작업에는 multi-agent/A2A를 강제하지 말고, single-agent-sufficient면 simpler route로 유지 또는 collapse하라고 명시합니다. 또한 `PROMPT_full.md`, `PROMPT_multi_agent_overlay.md`, `AGENTS.md`는 scope widening 금지와 smallest safe change를 직접 요구하므로 speculative patch widening도 보이지 않습니다. `PROMPT_example_catalog.md`는 routing-shaped examples가 router policy owner가 아니라고 하므로, 판단 근거가 예시나 operator-only 문서에 의존하지도 않습니다.","limitations":["문서 기반 런타임 번들 판정이며 실제 assembled replay 실행 상태를 검증한 것은 아닙니다.","과제가 실제로 비동기 원격 협업이나 distinct specialist split로 재구성되면 reroute 가능성은 남지만, 현재 시나리오 서술만으로는 그 필요가 직접 입증되지 않습니다."]}