{"scenario_id":"v32-external-harness-2026-05-06-a","bundle_id":"coding_core_patch_bundle","verdict":"Partial Pass","guide_alignment":"partially_aligned","evidence_strength":"indirect","operator_only_dependency":false,"over_orchestration":false,"speculative_patch_widening":false,"missing_operational_artifact_route":false,"recommended_patch_needed":true,"minimal_patch_targets":["prompt-stack/v32/codex/skills/coding-core/SKILL.md"],"evidence_files":["prompt-stack/v32/codex/skills/coding-core/SKILL.md","prompt-stack/v32/codex/CODEX_RUNTIME_GUIDE.md","prompt-stack/v32/01_base/PROMPT_standalone.md","prompt-stack/v32/02_overlays/PROMPT_tool_protocol_overlay.md","prompt-stack/v32/02_overlays/PROMPT_guardrails_safety_overlay.md"],"answer_summary":"Route is direct and local: use coding-core skill ownership rules to patch only the stale sentence in the owning codex-layer file, then perform a scoped consistency check in the same codex/doc set; no operator-only owner files are required.","verdict_rationale":"The active runtime layer contains explicit ownership and minimal-change repair guidance (single primary skill, local patch discipline, codex-layer scope), so fix path is available without widening. However, the exact stale owner sentence context is not explicitly localized in the sampled active content, reducing confidence in a precise one-line target.","limitations":["Direct stale sentence text was not observed in the read slice, so exact replacement wording is inferential.","No runtime-level execution artifacts were present/required for this doc-level correction, so validation remains documentation-structure-level rather than operationally replayed."]}